{
  "$schema": "http://json-schema.org/draft-07/schema#",
  "type": "object",
  "required": ["prompt", "metadata"],
  "properties": {
    "prompt": {
      "type": "string",
      "minLength": 1,
      "maxLength": 32768
    },
    "metadata": {
      "type": "object",
      "required": ["model", "timestamp", "version"],
      "properties": {
        "model": {
          "type": "string",
          "minLength": 1
        },
        "timestamp": {
          "type": "string",
          "format": "date-time"
        },
        "version": {
          "type": "string",
          "pattern": "^\\d+\\.\\d+\\.\\d+$"
        },
        "temperature": {
          "type": "number",
          "minimum": 0,
          "maximum": 2
        },
        "maxTokens": {
          "type": "integer",
          "minimum": 1,
          "maximum": 32768
        },
        "topP": {
          "type": "number",
          "minimum": 0,
          "maximum": 1
        },
        "frequencyPenalty": {
          "type": "number",
          "minimum": -2,
          "maximum": 2
        },
        "presencePenalty": {
          "type": "number",
          "minimum": -2,
          "maximum": 2
        }
      }
    },
    "context": {
      "type": "array",
      "items": {
        "type": "object",
        "required": ["role", "content"],
        "properties": {
          "role": {
            "type": "string",
            "enum": ["system", "user", "assistant"]
          },
          "content": {
            "type": "string",
            "minLength": 1
          }
        }
      }
    },
    "embeddings": {
      "type": "array",
      "items": {
        "type": "number"
      }
    },
    "security": {
      "type": "object",
      "properties": {
        "signature": {
          "type": "string"
        },
        "fingerprint": {
          "type": "string"
        },
        "auditTrail": {
          "type": "array",
          "items": {
            "type": "object",
            "required": ["timestamp", "action"],
            "properties": {
              "timestamp": {
                "type": "string",
                "format": "date-time"
              },
              "action": {
                "type": "string"
              },
              "actor": {
                "type": "string"
              }
            }
          }
        }
      }
    }
  }
}
