{
  "prompt": "Explain the concept of quantum computing to a high school student.",
  "metadata": {
    "model": "gpt-4",
    "timestamp": "2025-01-21T00:00:00Z",
    "version": "1.0.0",
    "temperature": 0.7,
    "maxTokens": 2048,
    "topP": 1.0,
    "frequencyPenalty": 0.0,
    "presencePenalty": 0.0
  },
  "context": [
    {
      "role": "system",
      "content": "You are a helpful AI tutor specializing in physics and computer science."
    },
    {
      "role": "user",
      "content": "Can you explain quantum computing in simple terms?"
    }
  ],
  "embeddings": [0.1, 0.2, 0.3, 0.4, 0.5],
  "security": {
    "fingerprint": "QmFzZTY0IGVuY29kZWQgc2hhMjU2IGhhc2g=",
    "auditTrail": [
      {
        "timestamp": "2025-01-21T00:00:00Z",
        "action": "created",
        "actor": "test_user"
      }
    ]
  }
}
